2011.09.22,,出口剛士, 高安秀樹, 高安美佐子,,日本物理学会2011年秋季大会, 富山大学,,リスクを最小化する通貨バスケットの推定手法,,,,,,,,
2011.09.22,,山崎航, 後藤友喜夫, 高安秀樹, 高安美佐子,,日本物理学会2011年秋季大会, 富山大学,,コンビニエンスストアのPOSデータと気温情報を用いた商品の最適仕入れ数の推定,,,,,,,,
2011.09.22,,由良嘉啓, 高安秀樹, 中村和幸, 高安美佐子,,日本物理学会2011年秋季大会, 富山大学,,粒子フィルタ法を用いたPUCKモデルのパラメータ推定,,,,,,,,
2011.09.09,,三浦航, 高安秀樹, 高安美佐子,,平成23年度統数研共同研究集会「経済物理学とその周辺」第1回研究会, 統計数理研究所,,複雑ネットワークの確率的成長モデルで見られるノードの凝集現象とその理論解析,,,,,,,
2011.09.09,,由良嘉啓, 高安秀樹, 中村和幸, 高安美佐子,,平成23年度統数研共同研究集会「経済物理学とその周辺」第1回研究会, 統計数理研究所,,粒子フィルタ法を用いたポテンシャルモデルのパラメータ推定,,,,,,,
2011.09.09,,田村 光太郎, 高安 秀樹, 高安 美佐子, 三浦 航, 後藤 隼人, 北島 聡,, 平成23年度統数研共同研究集会「経済物理学とその周辺」第1回研究会, 統計数理研究所,,企業ネットワーク構造と重力相互作用型モデルの関係,,,,,,,
2011.09.07,,渡辺隼史,高安秀樹,高安美佐子,,第52回数理社会学会大会(JAMS52),第7回ネットワークが創発する知能研究会(JWEIN'11)合同プログラム,,企業取引ネットワーク上の輸送とバイアスドランダムウォーク,,,,,,,
2011.08.18,,高安美佐子,田村光太郎,三浦航,高安秀樹,,非平衡系の物理-ミクロとマクロの架け橋,基礎物理学研究所,,企業ネットワークの相転移現象とノード間相互作用の推定,,,,,,,,
2011.07.15,,Yoshihiro Yura,Hideki Takayasu,Kazuyuki Nakamura,Misako Takaysu, Poster Session ,,International Conference on ΣΦ2011,Larnaca-Cyprus,,Observation of market potentials by a using particle filter method,,,,,,,
2011.07.15,,Misako Takayasu, <b>Oral Talk</b> ,,International Conference on ΣΦ2011,Larnaca-Cyprus,,Empirical Law and Mathmatical Models for the Statistics and Structure of Business Firm Networks,,,,,,,
2011.07.14,,Wataru Miura,Hideki Takayasu,Misako Takayasu,<b>Oral Talk</b>,,International Conference on ΣΦ2011,Larnaca-Cyprus,,Statistical properties of Japanese business firm network and a probabilistic model based on creation,annihilation and coagulation,,,,,,,
2011.06.13,,Misako Takayasu,<B>Invited Talk</B>,,21st International Conference on Noise and Fluctuations,Tronto,,Critical behavior observed in Collective Human Behavior,,,,,,,
2011.06.05,,Misako Takayasu,<B>Invited Talk</B>,,International Conference on Econophysics,Shanghai,,Application to PUCK formulation to Financial Market Fluctuation,,,ポジションを考慮したディーラーモデルによる為替市場のシミュレーション,,,,
2011.3.24,,山田健太、佐野幸恵、高安秀樹、高安美佐子,,平成22年度統数研研究会「経済物理とその周辺」第2回研究会,,ブログから観測される流行伝搬とニュース効果を再現するエージェントベースモデル,,,,,,,,
2011.3.15,,Kenta Yamada, Sidney Redner, Hideki Takayasu and Misako Takayasu,,75th Annual Meeting of the DPG and DPG Spring Meeting,,Relationship between ARCH model and stochastic dealer model,,,,,,,,
2011.03.3,,Misako Takayasu,<B>Invited Talk</B>,,Sano Lab.Seminar March 3rd,東大・理・物理・佐野研究室,,為替変動の物理学,,,,,,,,
2011.01.26,,Misako Takayasu <B>Invited Talk</B>,,Complexity science seminar: Scaling in Complex Systems, Imperial College, London,,Scaling features of a business firm network as a complex system,,,,,,
2011.01.22,,松永健太, 山田健太, 高安秀樹, 高安美佐子,,第6回 人工知能学会 ファイナンスにおける人工知能応用研究会, 東京大学,,ポジションを考慮したディーラーモデルによる為替市場のシミュレーション,,,,
2011.01.22,,山田健太, 高安秀樹, 高安美佐子,,第6回 人工知能学会 ファイナンスにおける人工知能応用研究会, 東京大学,,経済物理学的手法を用いたエージェントベースモデルによる金融市場のモデル化と応用,,,,,
2011.01.07,,渡邊隼史 <B>招待講演</B>,,「経済ネットワーク」研究会, キヤノングローバル戦略研究所,,複雑ネットワークの輸送とZipf's則,,,,,,,
2011.01.07,,三浦航 <B>招待講演</B>,,「経済ネットワーク」研究会, キヤノングローバル戦略研究所,,企業間取引ネットワークを再現する確率成長モデル,,,ディーラーモデルにおけるロスカットとロスリミット効果の関係,,,,
2010.10.02,,高安美佐子 <B>招待講演</B>,,第5回 人工知能学会 ファイナンスにおける人工知能応用研究会, 東京大学,,物理学の視点から見る金融市場と経済・社会現象,,,,,,,
2010.09.25,,三浦航, 高安秀樹, 高安美佐子,,日本物理学会2010年秋季大会, 大阪府立大学,,企業ネットワークにおける連鎖倒産確率モデルとパーコレーション相転移,,,,,
2010.09.24,,佐野幸恵, 山田健太, 高安秀樹, 高安美佐子,,日本物理学会2010年秋季大会, 大阪府立大学,,,日本語ブログにおける日常語の書き込み頻度の統計性とRandom Diffusion Modelの拡張,,,
2010.09.24,,上野弘道, 渡辺努, 高安美佐子,,日本物理学会2010年秋季大会, 大阪府立大学,,小売における商品販売数時系列の解析とモデル化,,,,,
2010.09.24,,後藤友喜夫, 高安秀樹, 高安美佐子,,日本物理学会2010年秋季大会, 大阪府立大学,,コンビニエンスストアのPOSデータを用いた気温と消費者行動の関係,,,,,
2010.09.24,,渡邊隼史, 佐野幸恵, 山田健太, 高安秀樹, 高安美佐子,,日本物理学会2010年秋季大会, 大阪府立大学,,,,,
2010.09.05-12,,Misako Takayasu <B>Invited Talk</B>,,2nd Greek-Turkish Conference on Statistical Mechanics and Dynamical Systems, Rhodos, Greece,,The structure and statistical properties of Japanese business firm network,,,,,,
2010.07.22,,Misako Takayasu <b>Oral presentation</b>,,Statphys 24, Cairns, Australia,,A dynamical potential model to financial markets and exact derivation of GARCH model,,,話題性のある言葉に着目したブログ書き込み数変動,,,
2010.07.22,,Wataru Miura, Hideki Takayasu and Misako Takayasu,,Statphys 24, Cairns, Australia (Poster session),,Analysis and modeling of Japanese business relationship network,,,,,
2010.06.07,,高安美佐子 <B>招待講演</B>,,蔵前技術士会第131回講演会, 東京工業大学蔵前会館,,大規模経済データから何が観測できるか－経済物理学の最前線で－,,,,,,,
2010.03.21,,佐野幸恵, 山田健太, 高安秀樹, Kimmo Kaski, 高安美佐子,,日本物理学会第65回年次大会, 岡山大学,,,,,
2010.03.21,,渡邊隼史, 高安秀樹, 高安美佐子,,日本物理学会第65回年次大会, 岡山大学,,関連する複数企業の財務情報の集約とその統計的性質,,,,,
2010.03.21,,三浦航, 高安秀樹, 高安美佐子,,日本物理学会第65回年次大会, 岡山大学,,日本企業100万社の企業間取引ネットワークにおけるリンク構造の解析について,,,,,
2010.03.21,,高安美佐子, 山田健太, 高安秀樹,,日本物理学会第65回年次大会, 岡山大学,,PUCKモデルに基づく市場安定性制御,,,,,
2010.03.21,,渡辺広太, 高安秀樹, 高安美佐子,,日本物理学会第65回年次大会, 岡山大学,,外乱が市場価格へ与える影響についてのPUCK解析,,,,,
2010.03.21,,山田健太, 高安秀樹, 高安美佐子,,日本物理学会第65回年次大会, 岡山大学,,外国為替市場の板情報から観測される需給と価格変動の関係,,,,,
2010.02.23,,高安美佐子 <B>招待講演</B>,,財務総合政策研究所ランチミーティング, 財務省,,PUCKモデルによる為替市場の観測とその応用－経済物理学最前線－,,,,,,,
2010.01.31,,三浦航, 高安秀樹, 高安美佐子,,第22回自律分散システム・シンポジウム, 名古屋大学,,企業間取引ネットワークにおけるオーソリティ・ハブ度の非対称性について,,,,,
2010.01.31,,山田健太, 高安秀樹, 高安美佐子,,第22回自律分散システム・シンポジウム, 名古屋大学,,ディーラーモデルによる外国為替市場のモデル化,,,,,
2010.01.31,,渡辺広太, 高安秀樹, 高安美佐子,,第22回自律分散システム・シンポジウム, 名古屋大学,,金融市場価格のトレンド形成における内生的要因とニュースインパクトの影響,,,,,
2009.11.04-07,,Yukie Sano, Kenta Yamada, Hideki Takayasu and Misako Takayasu,,Complex' 09, Tokyo,,Approaches to collective human dynamics using internet blog data,為替市場における板情報のモデル化,,,,
2009.10.25-31,,Kenta Yamada, Hideki Takayasu and Misako Takayasu,,Econophysics Colloquium 2009, Centro Ettore Maiorana Erice, (TP) Italy,,Analogies between financial market and catalysis,,,,,
2009.09.27,,山田健太, 高安秀樹, 高安美佐子,,日本物理学会2009年秋季大会, 熊本大学,,ディーラーモデルを用いた損切り効果と暴落現象の関係の解明,,,,,
2009.09.27,,美藤直紀, 山田健太, 高安秀樹, 高安美佐子,,日本物理学会2009年秋季大会, 熊本大学,,ノードの寿命を考慮した企業ネットワーク成長モデルの統計的性質,,,,
2009.09.27,,上野弘道, 渡辺努, 高安美佐子,,日本物理学会2009年秋季大会, 熊本大学,,小売における商品の新陳代謝の統計性,,,,,
2009.09.27,,渡邊隼史, 高安秀樹, 高安美佐子,,日本物理学会2009年秋季大会, 熊本大学,,日本企業の財務情報の統計的性質とその相互の関係,,,,,
2009.09.27,,三浦航, 水野貴之, 高安秀樹, 高安美佐子,,日本物理学会2009年秋季大会, 熊本大学,,外国為替市場における板情報の解析,,,,
2009.09.08,,三浦航, 渡邊隼史, 水野貴之, 高安秀樹,  高安美佐子,,京都大学基礎物理学研究所 2009年度前期研究会「経済物理学 2009 : ミクロとマクロの架け橋」, 京都大学(ポスターセッション),,,,,
2009.09.08,,高安美佐子,,京都大学基礎物理学研究所 2009年度前期研究会「経済物理学 2009 : ミクロとマクロの架け橋」, 京都大学,,PUCKモデルの展望：物理現象との関係と金融市場への応用,,,,,,,
2009.09.08,,山田健太, 高安秀樹, 伊藤隆敏,  高安美佐子,,京都大学基礎物理学研究所 2009年度前期研究会「経済物理学 2009 : ミクロとマクロの架け橋」, 京都大学,,,,,,
2009.08.18,,Misako Takayasu and Hideki Takayasu <B>Invited Seminar Talk</B>,,Barabasi Lab. Center for Complex Network Research,NORTHEASTERN UNIVERSITY,,Network Structure of Japanese Business Firms,,,,,,,
2009.07.07,,高安美佐子 <B>招待講演</B>,,第2回　ICAP Adovisary Board Meeting,　銀行倶楽部,,EBSデータから見える市場の市場の現象－経済物理学最前線－,,,,,,,
2009.06.08-12,,Kenta Yamada, Hideki Takayasu and Misako Takayasu,,International Workshop on Coping with Crises in Complex Socio-Economic Systems, Zurich,,Approaches to Financial Crisis by a Dealer Model of Financial Market,,企業ネットワークに見られるパーコレーション相転移,,,,
2009.06.04,,高安美佐子 <B>招待講演</B>,,日本マーケティング・サイエンス学会「消費者行動のダイナミクス研究会」と「言葉とマーケティング研究部会」との合同部会, （株）構造計画研究所,,大規模経済データから見える現象－経済物理学最前線－,,,,,,,
2009.03.30,,渡邊隼史, 高安秀樹, 高安美佐子,,日本物理学会第64回年次大会, 立教大学,,独立なランダム乗算過程から構成される系の統計則と企業集団の示す統計則,,,,,
2009.03.30,,高安美佐子 ,鮫島伸二郎, 大西立顕, 高安秀樹, ,,日本物理学会第64回年次大会, 立教大学,,企業ネットワークに見られるパーコレーション相転移,,,,
2009.03.30,,大西立顕, 高安秀樹, 高安美佐子,,日本物理学会第64回年次大会, 立教大学,,企業間取引のネットワーク構造に見られる統計的性質,,,,
2009.03.29,,山田健太, 高安秀樹, 高安美佐子,,日本物理学会第64回年次大会, 立教大学,,金融市場における取引過程と触媒反応のアナロジー, 立教大学,,ブログにおける人間の集団的振る舞いの解析とモデル化,,
2009.03.29,,渡辺広太, 高安秀樹, 高安美佐子,,日本物理学会第64回年次大会, 立教大学,,時変係数を持つLangevin系としての金融市場と府の粘性の観測,,,,,
2009.03.29,,上野弘道, 渡辺努, 高安美佐子,,日本物理学会第64回年次大会, 立教大学,,小売における販売時系列の解析,,,,,
2009.03.27,,佐野幸恵, 山田健太, 渡辺広太, 水野貴之, 高安秀樹, 高安美佐子,,日本物理学会第64回年次大会,,ブログにおける人間の集団的振る舞いの解析とモデル化,,,
2009.03.30,,Misako Takayasu　<B>基調講演</B>,,RIETI 政策シンポジウム『大規模データから何を学ぶか－経済学と物理学の統合アプローチ』, 如水会館,,Human Behavior in Marketing（http://www.rieti.go.jp/jp/events/09030501/info.html),,, Japan,,Modeling statistical properties of human blogging,,
2009.03.04,,H. Watanabe, H. Takayasu and M. Takayasu,,Application of Physics in Financial Analysis 7th Internantional Conference, Tokyo, Japan,,Central limit theorem of random multiplicative processes and application to firm growth problems,,,,,
2009.03.04,,Hiromichi UENO, Tsutomu WATANABE and Misako TAKAYASU,,Application of Physics in Financial Analysis 7th Internantional Conference, Toky, Japan,,Statistical properties of purchase number fluctuations in Japanese supermarkets,,,,,
2009.03.03,,Y. Sano, K. Yamada, K. Watanabe, T. Mizuno, H. Takayasu and M. Takayasu,,Application of Physics in Financial Analysis 7th Internantional Conference, Tokyo,,,,,
2009.03.03,,Kenta Yamada, Hideki Takayasu and Misako Takayasu,,Application of Physics in Financial Analysis 7th Internantional Conference, Tokyo, Japan,,The role of loss-limit of dealers in financial market crisis,,,,,
2009.03.02,,Kota Watanabe, Hideki Takayasu and Misako Takayasu,,Application of Physics in Financial Analysis 7th Internantional Conference, Tokyo, Japan,,Approaches to the financial market crisis from the viewpoint of PUCK model,,,,,
2009.03.02,,Y. Ohya, H. Takayasu and M. Takayasu,,Application of Physics in Financial Analysis 7th Internantional Conference, Tokyo, Japan (Poster session),,Statistical steady states of random transport on random scale-free networks,,,,,
2009.03.02,,K. Araki, and M. Takayasu,,Application of Physics in Financial Analysis 7th Internantional Conference, Tokyo, Japan (Poster session),,Confirmation of Poissonian properties in high precision sales data of convenient stores,,,,,
2009.03.02,,Yohei Watanabe, Takayuki Mizuno, Jun-ichi Maskawa and Misako Takayasu,,Application of Physics in Financial Analysis 7th Internantional Conference, Tokyo, Japan (Poster session),,The statistical laws of order intervals in London stock market,,,,
2009.03.02,,Shinjiro Sameshima, Takaaki Ohnishi, Hideki Takayasu and Misako Takayasu,,Application of Physics in Financial Analysis 7th Internantional Conference, Tokyo, Japan (Poster session),,The role of strongly-connected components in the network of Japanese companies,,,,
2009.01.29,,高安美佐子 <B>招待講演</B>,,第58回人工知能セミナー『経済物理学の最前線で』,,序章-大規模経済データが語る経済現象,,,,,,,,
2009.01.24,,渡邊隼史，高安秀樹，高安美佐子,,平成20年度統数研研究会「経済物理とその周辺」第2回研究会,,ランダム乗算過程における中心極限定理と企業の成長率分布,,,,,,,,
2009.01.24,,渡辺広太，高安秀樹，高安美佐子,,平成20年度統数研研究会「経済物理とその周辺」第2回研究会,,時間変化する粘性係数をもつLangevin系としての金融市場と負の粘性の観測,,,,,,,,
2009.01.24,,山田健太，高安秀樹，高安美佐子,,平成20年度統数研研究会「経済物理とその周辺」第2回研究会,,金融市場におけるディーラーの戦略の時間発展と価格変動の統計的性質の関係,,,,,,,,
2009.01.23,,渡邊隼史，高安秀樹，高安美佐子,,第21回自律分散システムシンポジウム,,ランダム乗算過程と拡張された中心極限定理,,,,,,,,
2008.12.18,,高安美佐子 <B>招待講演</B>,,計測自動制御学会2008年度第3回システム工学部会,,金融市場の変動をリアルタイムで分析する経済物理モデル,,,,,,,,
2008.09.24-25,,佐野幸恵，山田健太，渡辺広太，水野貴之，高安秀樹，高安美佐子,,成20年度統数研研究会「経済物理とその周辺」第1回研究会,,ウェブ上の単語出現頻度のゆらぎと社会現象との関連,,,,,,,,
2008.09.20-23,,佐野幸恵，山田健太，渡辺広太，水野貴之，高安秀樹，高安美佐子,,日本物理学会2008年秋季大会, 岩手大学,,ブログ記事に見られる単語の出現頻度のゆらぎの解析,,,,,,,
2008.09.20-23,,鮫島伸二朗，大西立顕，池田祐一，高安秀樹，高安美佐子,,日本物理学会2008年秋季大会, 岩手大学,,日本企業ネットワークのバックボーン解析,,,,,,,
2008.09.20-23,,上野弘道，高安秀樹, 高安美佐子,,日本物理学会2008年秋季大会, 岩手大学,,小売における販売量の統計性,,,,,,
2008.09.20-23,,高安美佐子, 荒木康,,日本物理学会2008年秋季大会, 岩手大学,,販売量と廃棄量の時系列データに基づく最適販売戦略の推定,,,,,,
2008.09.20-23,,山田健太，高安秀樹, 高安美佐子,,日本物理学会2008年秋季大会, 岩手大学,,確率論的ディーラーモデルの繰り込み理論,,,,,,
2008.09.20-23,,渡邊隼史，高安秀樹, 高安美佐子,,日本物理学会2008年秋季大会, 岩手大学,,ランダム乗算過程のくりこみと安定分布,,,,,,
2008.09.20-23,,大家義登，高安秀樹, 高安美佐子,,日本物理学会2008年秋季大会, 岩手大学,,スケールフリー空間上のランダム輸送モデルの解析,,,Renormalization of Random Multiplicative Processes,,,
2008.09.20-23,,渡辺広太，水野貴之，高安秀樹, 高安美佐子,,日本物理学会2008年秋季大会, 岩手大学,,ポテンシャルモデルを用いた為替時系列の統計性の再現,, Nara, Japan,,Stochastic behaviors in human activity observed in internet blog,
2008.09.11-17,,Misako Takayasu <B>Plenary Invited Talk</B>,,GREEK-TURKISH CONFERENCE STATISTICAL MECHANICS AND DYNAMICAL SYSTEMS, Rhodos, Greece and Marmaris, Turkey,,Physical View of Market Prices : Random Walks in Complex Potential Functions,,,,,
2008.09.11-17,,Hideki Takayasu, Hayafumi Watanabe, Misako Takayasu <B>Plenary invited Talk</B>,,GREEK-TURKISH CONFERENCE STATISTICAL MECHANICS AND DYNAMICAL SYSTEMS, Rhodos, Greece and Marmaris, Turkey, Kiel, Germany,,Renormalization of random multiplicative processes,,
2008.09.09-12,,Y. Sano, K. Yamada, K. Watanabe, T. Mizuno, H. Takayasu, M. Takayasu,,Dynamic Days Asia Pacific 5(Poster session),,Stochastic behaviors in human activity observed in internet blog,,,
2008.08.28-30,,Hiromichi Ueno, Tsutomu Watanabe, Misako Takayasu,,Econophysics Colloquium 2008, Kiel, Germany,,Statistical properties of relation between sales and prices in retail,,,,
2008.08.28-30,,Y. Sano, K. Yamada, K. Watanabe, T. Mizuno, H. Takayasu, M. Takayasu,,Econophysics Colloquium 2008, Kolympari-Chania, Greece (Poster session),,Statistical properties of number fluctuations observed in internet blog keywords,,
2008.08.28-30,,Hayafumi Watanabe, Hideki Takayasu, Misako Takayasu,,Econophysics Colloquium 2008, Kiel, Germany,,Renormalization of random multiplicative processes and statistics of business-firm growth,,,,
2008.08.28-30,,Kota Watanabe, Hideki Takayasu, Misako Takayasu,,Econophysics Colloquium 2008, Kiel, Germany,,The Effect of Extended trading on emergence and collapse of the financial bubbles,,,,
2008.07.14-18,,Y. Sano, K. Yamada, K. Watanabe, T. Mizuno, H. Takayasu, M. Takayasu,,International Conference in ΣTATIΣTIKH ΦYΣIKH,,Statistical properties of number fluctuations observed in Internet blog keywords,,,
2008.07.04,,鮫島伸二朗, 大西立顕, 高安秀樹, 高安美佐子,,金融・産業ネットワーク研究会, 経済産業研究所,,日本企業100万社のネットワーク解析-日本企業のバックボーン解析-,,,,
2008.07.04,,高安美佐子, 大西立顕, 鮫島伸二朗, 高安秀樹,,金融・産業ネットワーク研究会, 経済産業研究所,,日本企業100万社のネットワーク解析-研究の概要-,,,,
2008.06.17,,高安美佐子 <B>招待講演</B>,,第2回ACPWS 「生物・生態系の統計力学」, 東京大学,,経済・社会現象における人間の集団行動の普遍性について,,,,,,,
2008.03.26,,佐野幸恵, 山田健太, 渡辺広太, 水野貴之, 高安美佐子,,日本物理学会第63回年次大会,,ウェブ上に出現する単語の高頻度時系列の統計的解析,,,,
2008.03.26,,渡邊隼史, 高安秀樹, 高安美佐子,,日本物理学会第63回年次大会,,ランダム乗算過程のN体くり込みモデルが示す極限分布,,,,,,
2008.03.26,,上野弘道, 渡辺努, 高安美佐子,,日本物理学会第63回年次大会,,小売りにおける販売量の価格に関する統計性,,,,,,
2008.03.26,,高安美佐子, 渡辺広太, 高安秀樹,,日本物理学会第63回年次大会,,時間変動する粘性を持つランジュバン系としての金融市場,,,,,,
2008.03.15,,佐野幸恵, 山田健太, 渡辺広太, 水野貴之, 高安秀樹, 高安美佐子,,平成19年度統数研研究会「経済物理とその周辺」第2回研究会,,ウェブ上に出現する単語の高頻度時系列の統計的解析,,,,
2008.03.15,,上野弘道, 渡辺努, 高安美佐子,,平成19年度統数研研究会「経済物理とその周辺」第2回研究会,,スーパーマーケットにおける販売量と価格の関係,,,,,,
2008.03.15,,渡辺広太, 高安秀樹, 高安美佐子,,平成19年度統数研研究会「経済物理とその周辺」第2回研究会,,株式市場における時間外取引の統計性とバブルへの影響,,,,,,
2007.12.25,,上野弘道, 渡辺努, 高安美佐子,,京都大学基礎物理学研究所 2007年度後期研究会「経済物理学III」, 京都大学,,小売における商品販売の統計的性質,,,,,
2007.12.25,,佐野幸恵, 山田健太, 渡辺広太, 水野貴之, 高安美佐子,,京都大学基礎物理学研究所 2007年度後期研究会「経済物理学III」, 京都大学(ポスターセッション),,web上での口コミに関する解析,,,
2007.12.25,,渡邊隼史, 高安秀樹, 高安美佐子,,京都大学基礎物理学研究所 2007年度後期研究会「経済物理学III」, 京都大学(ポスターセッション),,ランダム乗算過程のN体繰り込みと企業成長率の統計性,,,,,
2007.12.25,,水野貴之, 鳥山正博, 寺野隆雄, 高安美佐子,,京都大学基礎物理学研究所 2007年度後期研究会「経済物理学III」, 京都大学,,大規模POSデータを用いた消費行動の分析,,,,
2007.12.25,,水野貴之, 荒木康, 鳥山正博, 寺野隆雄, 高安美佐子,,京都大学基礎物理学研究所 2007年度後期研究会「経済物理学III」, 京都大学(ポスターセッション),,商品の販売寿命と顧客の購買行動の関係,,,
2007.12.25,,山田健太, 高安秀樹, 高安美佐子,,京都大学基礎物理学研究所 2007年度後期研究会「経済物理学III」, 京都大学,,確率論的ディーラーモデルの理論解析,,,,,
2007.12.25,,渡辺広太, 高安秀樹, 高安美佐子,,京都大学基礎物理学研究所 2007年度後期研究会「経済物理学III」, 京都大学,,高次ポテンシャルを用いた暴騰・暴落の早期予測可能性,,,,,
2007.12.25,,高安美佐子 <B>招待講演</B>,,京都大学基礎物理学研究所 2007年度後期研究会「経済物理学III」, 京都大学,,市場価格のポテンシャル理論とその実践的応用,,,,,,,
2007.11.06,,高安美佐子 <B>招待講演</B>,,第10回情報論的学習理論ワークショップ、東京工業大学,,市場価格のランダムウォークとポテンシャル理論,,,,,,,,
2007.10.25,,山田健太, 高安秀樹, 高安美佐子 <B>招待講演</B>,,日本銀行セミナー，日本銀行金融研究所,,確率論的ディーラーモデルを用いた外国為替市場の統計性の再現と解明,,,,,,
2007.09.23,,高安美佐子 <B>シンポジウム講演</B>,,日本物理学会第62回年次大会領域11シンポジウム「経済現象の予測・制御の可能性」,北海道大学,,金融市場のダイナミクスと予測可能性,,,,,,,,
