2018.9.25,,Kenta Yamada, Hideki Takayasu, Misako Takayasu,,Conference on Complex Systems 2018, Thessaloniki, Greece,,Estimation of economic indicator from big blog data 
2018.9.14,,Takumi Sueshige,,Econophysics Colloquium 2018,Palermo, Italy,,Ecology of trading strategies on the basis of the response pattern to historical market trends
2018.9.14,,Kiyoshi Kanazawa,,Econophysics Colloquium 2018,Palermo, Italy,,Trading-log Analysis of Individual Traders: Microscopic Kinetic Theory for Financial Brownian Motion
2018.9.13,,Jun'Ichi Ozaki,,Econophysics Colloquium 2018,Palermo, Italy,,Dynamical model of Japanese inter-firm trading network: for GDP simulation
2018.9.12,,新井琢己, 高安秀樹, 高安美佐子,,日本物理学会2018年秋季大会,同志社大学,,指数移動平均PUCKモデルの粒子フィルタを用いた為替市場の変化点検出
2018.9.12,,奥富航、尾崎順一, 高安秀樹, 高安美佐子,,日本物理学会2018年秋季大会,同志社大学,,重力モデルを用いた企業倒産によるお金の流れの変化の推定
2018.9.11,,高木英美子, 山田健太、高安秀樹, Shlomo Havlin, 高安美佐子,,日本物理学会2018年秋季大会,同志社大学,,文書の類似度ネットワークを用いたカテゴリー識別の定量的評価
2018.9.9,,小林祐一朗, 高安秀樹, 高安美佐子,,日本物理学会2018年秋季大会,同志社大学,,平均流ダイアグラムから見る日本企業の時間発展とスケーリング則
2018.9.9,,末重拓己, 金澤輝代士, 高安秀樹, 高安美佐子,,日本物理学会2018年秋季大会,同志社大学,,金融市場におけるトレーディング戦略の生態系分析
2018.9.9,,山田健太、高安秀樹, 高安美佐子,,日本物理学会2018年秋季大会,同志社大学,,大規模ブログデータを用いた経済指標の推定
2018.9.9,,佐野幸恵, Orr Levy、高安秀樹, Shlomo Havlin, 高安美佐子,,日本物理学会2018年秋季大会,同志社大学,,フェイクニュース伝播ネットワークの構造的異質性
2018.9.9,,盛田健人, 山田健太、高安秀樹, 高安美佐子,,日本物理学会2018年秋季大会,同志社大学,,ブログ空間上におけるブロガーの投稿間隔と興味の変遷
2018.6.5,,高安美佐子, <b>招待講演</b>,,Capital Fund Management社セミナー, ザ・ペニンシュラ東京（東京）,,社会・経済に役立つ物理学：金融市場へのアプローチ
2018.3.24,,佐野幸恵, Orr Levy, 高安秀樹, Shlomo Havlin, 高安美佐子,,日本物理学会第73回年次大会,東京理科大学,,正しい情報と誤情報における拡散ネットワークの統計的解析
2018.3.25,,迫田元, 高安秀樹, 高安美佐子,,日本物理学会第73回年次大会,東京理科大学,,非定常時系列のパラメータ推定手法とそのPOSデータへの応用
2018.3.25,,尾崎順一, 高安秀樹, 高安美佐子,,日本物理学会第73回年次大会,東京理科大学,,企業間取引ネットワーク構造を用いた企業成長予測
2018.3.25,,小林祐一朗, 高安秀樹, 高安美佐子,,日本物理学会第73回年次大会,東京理科大学,,日本企業の確率的時間発展と企業サイズ分布の安定性
2018.3.25,,志田洋平, 田村光太郎,高安秀樹, 高安美佐子,,日本物理学会第73回年次大会,東京理科大学,,大規模GPSデータを用いた人の流動解析
2018.3.25,,Jean-Francois Boilard, Kiyoshi Kanazawa, Hideki Takayasu, Misako Takayasu,,日本物理学会第73回年次大会,東京理科大学,,Numerical Simulation of the Market Event Scaled Relations in the Foreign Currency Market
2018.3.25,,金澤輝代士, 末重拓己, 高安秀樹, 高安美佐子,,日本物理学会第73回年次大会,東京理科大学,,金融市場のミクロモデルと平均場解析
2018.2.23,,高安美佐子, <b>招待講演</b>,,富士通研究所（東京）,,「未来観測所」からみた日本の現在と未来
2017.9.21,,末重拓己, 金澤輝代士, 高安秀樹, 高安美佐子,,日本物理学会2017年秋季大会,岩手大学,,外国為替市場の個々のトレーダーの短期トレンドフォロー解析
2017.9.21,,田村光太郎,高安秀樹, 高安美佐子,,日本物理学会2017年秋季大会,岩手大学,,複雑ネットワーク上の非線形重力型輸送の平均場近似による転移点の評価
2017.9.21,,尾崎順一, 高安秀樹, 高安美佐子,,日本物理学会2017年秋季大会,岩手大学,,モデル化された企業間取引ネットワークにおける相転移現象
2017.9.21,,Jean-Francois Boilard, Kiyoshi Kanazawa, Hideki Takayasu, Misako Takayasu,,日本物理学会2017年秋季大会,岩手大学,,Hazard Function of Market Events in Foreign Currency Market
2017.9.23,,高木英美子, 田村光太郎, 山田健太, 高安秀樹, Shlomo Havlin, 高安美佐子,,日本物理学会2017年秋季大会,岩手大学,,文書間の類似度から構成される情報拡散ネットワークにおけるカテゴリー識別
2017.9.23,,小林祐一朗, 高安秀樹, 高安美佐子,,日本物理学会2017年秋季大会,岩手大学,,日本企業の大規模時系列データを用いた企業成長パターンの抽出
2017.9.24,,佐野幸恵, 高安秀樹, 高安美佐子,,日本物理学会2017年秋季大会,岩手大学,,ソーシャルメディアにおける大衆感情の周期性
2017.9.16,,高安美佐子, <b>招待講演</b>,,JAWS 2017 ワークショップ,鴨川ホテル三日月(千葉県鴨川市),,企業取引関係のモデリングとシステムに起因するリスクの解明
2017.9.14,,高安美佐子, <b>講演</b>,,東京工業大学 ヒューマンインターフェースとビッグデータ解析ワークショップ,品川センタービルディング（東京）,,「未来観測所」からみた日本企業の現在と未来
2017.8.25,,高安美佐子, <b>講演</b>,,京×データサイエンス シンポジウム,丸ビルホール（東京）,,「未来観測所」から見える日本企業の現状と未来：「京」をつかって
2017.7.12,,Misako Takayasu, <b>Invited Talk</b>,,International Conference on ΣΦ conference,Corfu-Greece,,Growth dynamics of complex business firms network,,
2017.7.5,,Misako Takayasu, <b>Invited Talk</b>,,13th Econophysics Colloquium & 9th Polish Symposium on Physics in Economy and Social Sciences,Warsaw,,Business firms networks:From basic properties to advanced application,,
2017.6.19,,Misako Takayasu, <b>Invited Talk</b>,,2ND Workshop on Statistical Physics for Financeal and Economic Networks NetSci2017,China,,Dynamical Properties of Monetary Flow on Business Transaction Networks,,
2017.6.16,,Matsuko Hatano, Satoshi Matsuoka, Misako Takayasu, <b>IDEASLAB Session talk</b>,,Annual Meeting of the New Champions 2017, World Economic Forum (Davos 2017) ,China,,Sensors, Simulations and Supercomputing with Tokyo Institute of Technology,,
2017.6.16,,Misako Takayasu, <b>Invited Talk</b> ,,Annual Meeting of the New Champions 2017, World Economic Forum (Davos 2017),China,,Rethinking Economics for the Real World,,
2017.5.29,,Misako Takayasu, <b>Invited Talk</b>,,International Conference on Econophysics,East China University of Science and Technology, Shanghai, China,,Modeling B-to-B transaction networks:Structure,flow and advanced applications
2017.3.20,,高木英美子, 田村光太郎, 山田健太, 高安秀樹, 高安美佐子,,日本物理学会2016年秋季大会,大阪大学,,文書間の類似度から構成されるブログ空間における情報拡散ネットワーク
2017.3.20,,小林祐一朗, 高安秀樹, 高安美佐子,,日本物理学会2016年秋季大会,大阪大学,,日本企業における企業状態3変数のスケーリング則と時系列から見るその動的起源
2017.3.20,,亀井英人, 高安秀樹, 樺島祥介, 高安美佐子,,日本物理学会2016年秋季大会,大阪大学,,企業財務データを用いた倒産予測モデルと変数選択
2017.3.20,,Jean-Francois Boilard, Kiyoshi KanazawaHideki Takayasu, Misako Takayasu,,日本物理学会2016年秋季大会,大阪大学,,Scaling relation between cancellation and submission rates in foreign currency market
2017.3.20,,金澤輝代士, 末重拓己, 高安秀樹, 高安美佐子,,日本物理学会2016年秋季大会,大阪大学,,外国為替市場のミクロ動力学の分析：ミクロからマクロへ
2017.3.20,,末重拓己, 金澤輝代士, 高安秀樹, 高安美佐子,,日本物理学会2016年秋季大会,大阪大学,,外国為替市場におけるトレンド発生時の注文分布変化
2017.3.11,,Kiyoshi Kanazawa, Takumi Sueshige, Hideki Takayasu, Misako Takayasu,,Econophysics and Econometric Analysis Based on the EBS data sets,,Application of Molecular Kinetic Theory to Financial Brownian Motion
2017.3.10,,Kiyoshi Kanazawa, Takumi Sueshige, Hideki Takayasu, Misako Takayasu,,ジャムドマターの非ガウスゆらぎとレオロジー,,Application of the kinetic theory to reveal the non-Gaussianity in finance
2017.3.7,,金澤輝代士，末重拓己，高安秀樹，高安美佐子,,統計物理学懇談会,,金融市場のブラウン運動のミクロ導出の試み：分子運動論の数理の応用
2017.3.5,,Misako Takayasu, <b>Invited Talk</b>,,International Workshop on Dynamic Risk Management of Transport Network,Tokyo Institute of Technology,,Dynamical Money Transport on One Million Business Transaction Network
2016.12.13,,Misako Takayasu, <b>Invited Talk</b>,,APCTP 2016 Workshop on Frontiers of Physics,,Generalized Central Limit Theorem for Randomly Growing Aggregates
2016.11.24,,シュロモ・ハブリン,,帝国データバンクの共催シンポジウム,東京工業大学,,ネットワーク科学：ビッグデータを理解するための基盤
2016.11.24,,ディディエ・ソネット,,帝国データバンクの共催シンポジウム,東京工業大学,,ビッグデータの弱点：頻度の低い巨大事象に注意せよ
2016.11.24,,高安美佐子,,帝国データバンクの共催シンポジウム,東京工業大学,,TDB企業データを用いたネオGDPの計算＋日本の未来を見る
2016.11.18,,Misako Takayasu,,School of Mathmatical Sciences, Faculty of Science and Technology,University Kebangsaan Malaysia,,Social media analysis
2016.11.16,,Misako Takayasu, <b>Plenary Talk</b>,,ICMS4(THE 4TH INTERNATIONAL CONFERENCE ON MATHEMATICAL SCIENCES),,Complex Network of Business Firms From Basic Properties to Advanced Applications
2016.11.14,,Misako Takayasu,,ICMS4(THE 4TH INTERNATIONAL CONFERENCE ON MATHEMATICAL SCIENCES),,Complex Networks:Fractals and Power Law
2017.11.10,,金澤輝代士，末重拓己，高安秀樹，高安美佐子,,第59回自動制御連合講演会,,多体確率過程論を用いた外国為替市場の記述
2016.11.4,,Misako Takayasu,,Imperial College London- Tokyo Tech joint workshop on biosicence and its interface with technology,,Introduction of Advanced Data Analysis and Modeling Unit(ADAM)
2016.09.29.,,高安美佐子 <B>招待講演</B>,,平成２８年度第一回分析評価勉強会,,ビッグデータ解析（応用編）
2016.09.29.,,田村光太郎 <B>招待講演</B>,,平成２８年度第一回分析評価勉強会,,ビッグデータ解析（基礎編）
2016.09.19.,,Misako Takayasu <B>Invited Talk: Keynote Speaker</B>,,The Conference on Complex Systems 2016, Amsterdam,,Modeling & Application of Transaction Network of Real Business Firms
2016.9.19,,Arthur Matsuo Yamashita Rios de  Sousa, Hideko Takayasu,  Misako Takayasu,,Conference on Complex Systems 2016,,Using statistical symmetries to characterize binary time series of the foreign exchange market
2016.9.16,,近藤洋平, 高安秀樹, 高安美佐子,,日本物理学会2016年秋季大会,金沢大学,,行列分解を用いたネットワークの特徴付け
2016.9.16,,小林祐一朗, 高安秀樹, 高安美佐子,,日本物理学会2016年秋季大会,金沢大学,,日本企業の大規模時系列データを用いた企業状態変数の軌道の解析
2016.9.16,,村上優太, 高安秀樹, 高安美佐子,,日本物理学会2016年秋季大会,金沢大学,,日本の企業間取引ネットワークにおける輸送と成長の関係
2016.9.15,,田村光太郎, 高安秀樹, 高安美佐子,,日本物理学会2016年秋季大会,金沢大学,,ネットワーク上の重力型輸送における分配比率の特性
2016.9.15,,河本弘和, 高安秀樹, 高安美佐子,,日本物理学会2016年秋季大会,金沢大学,,企業間ネットワークにおけるパーコレーション転移
2016.9.13,,亀井英人, 高安秀樹, 樺島祥介, 河本弘和, 後藤隼人, 村上優太, 高安美佐子,,日本物理学会2016年秋季大会,金沢大学,,倒産予測と企業間ネットワーク
2016.09.12.,,Misako Takayasu, <B>Invited Talk: Plenaly Speaker</B>,,Uppsala University Angstrom Labratory,,Big Data Analysis and Modeling for Super Smart Society
2016.09.08.,,Misako Takayasu, <B>Invited Talk: Plenaly Speaker</B>,,6th IFAC Workshop on Distributed Estimation and Control in Networked System,,Instability of Nationwide Business Transaction Network
2016.08.31.,,高安美佐子,,異常拡散現象をめぐる最近の進展、慶応義塾大学日吉キャンパス,,企業ネットワークにおける異常拡散
2016.08.31.,,金澤輝代士,,異常拡散現象をめぐる最近の進展、慶応義塾大学日吉キャンパス,,外国為替市場のミクロ構造：データ解析からミクロ理論まで
2016.8.26,,Hideto Kamei, Hideki Takayasu, Yoshiyuki Kabashima, Hirokazu Kawamoto, Hayato Goto, Yuta Murakami and Misako Takayasu,,Asia-Pacific Econophysics Conference 2016,東京大学,,Bankruptcy Prediction with Interfirm Network Structure
2016.08.25.,,Kiyoshi Kanazawa , Takumi Sueshige, Hideki Takayasu, and Misako Takayasu,,APEC 2016 in Tokyo University,,Kinetic description of the foreign exchange markets
2016.8.25,,Koutarou Tamura, Hideki Takayasu and Misako Takayasu,,Asia-Pacific Econophysics Conference 2016,東京大学,,Estimation of sales-change caused by structural change of an interfirm trading network and its verification 
2016.8.24,,Hirokazu Kawamoto, Hideki Takayasu and Misako Takayasu,,Asia-Pacific Econophysics Conference 2016,東京大学,,Extinction of Links and Resulting Percolation in a Japanese Business Relation Network
2016.8.24,,Yohei Kondo, Hideki Takayasu and Misako Takayasu,,Asia-Pacific Econophysics Conference 2016,東京大学,,Structure of Japanese Inter-firm Multiplex Networks
2016.8.24,,Yuh Kobayashi, Hideki Takayasu and Misako Takayasu,,Asia-Pacific Econophysics Conference 2016,東京大学,,Tracking Firm State Variables through Long Time-Series Data of Japanese Firms
2016.8.24,,Yuta Murakami, Hideki Takayasu and Misako Takayasu,,Asia-Pacific Econophysics Conference 2016,東京大学,,Growth Model of Japanese Inter-firm Trading Network with Money Transport
2016.5.28,,田村光太郎,,経済物理学セミナー,森の家（久野屋）＠河口湖,,企業間ネットワーク上の非線形輸送モデル
2016.03.21.,,金澤輝代士 <B>招待講演</B>,,第10回若手奨励賞受賞講演，東北学院大学,,非ガウス型ノイズに駆動されるランジュバン方程式の理論
2015.12.08.,,金澤輝代士 <B>招待講演</B>,,粉体工学会 『計算粉体力学研究会』，同志社大学,,粉体ガス中のローター動力学：非ガウス揺らぎの微視的導出
2015.11.05.,,Misako Takayasu <B>Invited Talk</B>,,Fens2015(8th Polish Symposium on Econo-and Sociophysics), Rzeszow, Poland,,Analysis and modeling of complex business relation network,,,,,,
2015.10.22.,,Misako Takayasu <B>Invited Talk</B>,,The Latin-America School and International Workshop on Foundations of Complexity-Nonadditive entropies and nonextensive statistical mechanics, Rio de Janeiro, Brazil,,Various power laws in business firms and evolution dynamics of their trading network,,,,,,
2015.09.20.,,高安美佐子, <b>招待講演</b>,,宇宙から脳まで 自然科学研究の”ビッグバン”－コンピュータが切り開く自然科学の未来―、名古屋大学,,ビッグデータと数理モデル：経済物理学の先端で
2015.09.18.,,田村光太郎,高安秀樹,高安美佐子,,日本物理学会2015年秋季大会,関西大学千里山キャンパス,,複雑ネットワークから抽出される流路分岐構造の特徴づけ
2015.09.18.,,河本弘和,高安秀樹,高安美佐子,,日本物理学会2015年秋季大会,関西大学千里山キャンパス,,企業間取引ネットワーク上の重み付きパーコレーション
2015.09.18.,,後藤隼人,高安秀樹,高安美佐子,,日本物理学会2015年秋季大会,関西大学千里山キャンパス,,生成、消滅、凝集を考慮したネットワーク成長モデルのパラメータ依存性の解析
2015.09.18.,,Boilard Jean-Francois, Hideki Takayasu, Misako Takayasu,,The Physical Society of Japan,Kansai University Senriyama Campus,,Cancellation Orders in Foreign Currency Market
2015.09.18.,,福永岳,高安秀樹,高安美佐子,,日本物理学会2015年秋季大会,関西大学千里山キャンパス,,コンビニエンスストアのPOSデータを用いた販売数時系列のゆらぎの解析
2015.09.18.,,用害愛希,田村光太郎,高安秀樹,高安美佐子,,日本物理学会2015年秋季大会,関西大学千里山キャンパス,,企業ネットワークにおける重力相互作用モデルの検証
2015.09.18.,,Yamashita Rios De Sousa,Arthur Matsuo, Hideki Takayasu, Misako Takayasu,,The Physical Society of Japan,Kansai University Senriyama Campus,,Irreversibility in the Foreign Exchange Market
2015.09.18.,,Khan Md. Mahfuzus Salam, Yoshihiro Yura, Hideki Takayasu, Misako Takayasu,,The Physical Society of Japan,Kansai University Senriyama Campus,,Developing a market status indicator tool for financial market by applying PUCK model
2015.09.18.,,末重拓己,高安秀樹,高安美佐子,,日本物理学会2015年秋季大会,関西大学千里山キャンパス,,マイクロ-ストラクチャノイズを利用した外国為替市場の変化点検出
2015.09.17.,,濱野倫弥,金澤輝代士,高安秀樹,高安美佐子,,日本物理学会2015年秋季大会,関西大学千里山キャンパス,,市場参加者数の変動を考慮した開放系ディーラーモデル
2015.09.17.,,村上優太,高安秀樹,高安美佐子,,日本物理学会2015年秋季大会,関西大学千里山キャンパス,,ネットワーク成長の優先的選択則とネットワーク上の輸送の関係性
2015.09.14.,,Koutarou Tamura, Hideki Takayasu, Misako Takayasu,,Econophysics Colloquium 2015, Prague, Czech Republic,,Exposing basin structures embedded in a complex network
2015.09.14.,,Boilard Jean-Francois, Hideki Takayasu, Misako Takayasu,,Econophysics Colloquium 2015, Prague, Czech Republic,,Cancellation Orders and Market Price Movement in Foreign Currency Market
2015.09.14.,,Yamashita Rios De Sousa,Arthur Matsuo, Kiyoshi Kanazawa, Hideki Takayasu, Misako Takayasu,,Econophysics Colloquium 2015, Prague, Czech Republic,,Reversibility study in sign time series of the foreign exchange market
2015.09.14.,,Takumi Sueshige, Hideki Takayasu, Misako Takayasu,,Econophysics Colloquium 2015, Prague, Czech Republic,,Detecting the change-point of the foreign exchange market using the microstructure noise
2015.09.14.,,Misako Takayasu, <b>Invited talk</b>,, Econophysics Colloquium 2015, Prague,,Practical application of mathematical models of business firm networks
2015.09.14.,,Hideki Takayasu, <b>Invited talk</b>,, Econophysics Colloquium 2015, Prague,,Fluctuation-dissipation relations derived from high-quality order-book data of foreign exchange market
2015.08.18.,,Kiyoshi Kanazawa, <b>Invited talk</b>,,Yukawa International Seminar 2015: New Frontiers in Non-Equilibrium Statistical Physics 2015, Kyoto, YITP,,Minimal Model of Stochastic Athermal Systems: Origin of Non-Gaussian Noise
2015.07.14.,,Misako Takayasu, <b>Invited talk</b>,,Symposium on Complex Network Approaches to Business Relations, London, United Kingdom,,Mathematical models of business firm networks
2015.03.24.,,田村光太郎,高安秀樹,高安美佐子,,日本物理学会2015年春季大会,早稲田大学早稲田キャンパス,,非線形輸送方程式の相転移と構造の関係
2015.03.24.,,河本弘和,高安秀樹,高安美佐子,,日本物理学会2015年春季大会,早稲田大学早稲田キャンパス,,パーコレーションシミュレーションの企業間ネットワークへの応用
2015.03.24.,,後藤隼人,高安秀樹,高安美佐子,,日本物理学会2015年春季大会,早稲田大学早稲田キャンパス,,実データを用いた企業間取引ネットワークの成長過程の解析
2015.03.24.,,Boilard Jean-Francois, Hideki Takayasu, Misako Takayasu,,The Physical Society of Japan,Waseda University Waseda Campus,,Order lifetime distributions in Foreigner Currency Market
2015.03.24.,,小峰卓郎,高安秀樹,高安美佐子,,日本物理学会2015年春季大会,早稲田大学早稲田キャンパス,,新手法を用いたPUCKモデルのパラメータ推定精度の解析
2015.03.24.,,用害愛希,田村光太郎,高安秀樹,高安美佐子,,日本物理学会2015年春季大会,早稲田大学早稲田キャンパス,,企業ネットワークにおける重力相互作用モデルの検証
2015.03.24.,,Khan Md. Mahfuzus Salam, Yoshihiro Yura, Misako Takayasu,,The Physical Society of Japan,Waseda University Waseda Campus,,Time-series analysis for stock prices to realize market behavior by applying PUCK model
2015.03.24.,,末重拓己,高安秀樹,高安美佐子,,日本物理学会2015年春季大会,早稲田大学早稲田キャンパス,,板情報の時間変化から観測される粘性係数のゆらぎ
2015.03.23.,,佐藤和也,高安秀樹,高安美佐子,,日本物理学会2015年春季大会,早稲田大学早稲田キャンパス,,ブログ空間における時系列分割手法の提案とその評価
2015.03.23.,,福永岳,高安秀樹,高安美佐子,,日本物理学会2015年春季大会,早稲田大学早稲田キャンパス,,ブログ書き込みと消費者行動の関係性
2015.03.21.,,宇賀山和也,高安秀樹,高安美佐子,,日本物理学会2015年春季大会,早稲田大学早稲田キャンパス,,PUCKモデルによるリスク評価
2015.03.19.,,Kazuya Satou, Hideki Takayasu, Misako Takayasu,,79th Annual Meeting of the DPG and DPG Spring Meeting, Berlin,,Proposal of segmentation method of time series in the blogosphere
2015.03.11.,,高安美佐子, <b>招待講演</b>,,複雑コミュニケーションサイエンス研究会、立命館大学,,企業ネットワークデータの解析とその応用
2015.02.20.,,田村光太郎,高安秀樹,高安美佐子,,複雑ネットワーク・ウィンターセッション2015,北海道大学,,大規模企業間取引データの解析と非線形輸送現象
2015.02.10.,,高安美佐子, <b>招待講演</b>,,応用数学連携フォーラムAMFワークショップ、東北大学,,企業間取引のビッグデータと数理モデル
2014.12.26.,,高安美佐子, <b>招待講演</b>,,国際高等研究所 研究プロジェクト (開催地：国際高等研)　2014年度 第2回研究会,,企業ネットワークの数理とその応用
2014.11.05.,,Koutarou Tamura, Hideki Takayasu, Misako Takayasu,,Social Modeling and Simulations + Econophysics Colloquium 2014, Kobe, Japan, 2014,,Basin structures of a complex network with strongly biased nonlinear flow
2014.11.05.,,Katsuhide Takahashi, Tsuyoshi Deguchi, Hideki Takayasu, Misako Takayasu,,Social Modeling and Simulations + Econophysics Colloquium 2014, Kobe, Japan, 2014,,Hubs and Authorities in the World Trade & World Investment Network
2014.11.05.,,Hayato Goto, Hideki Takayasu, Misako Takayasu,,Social Modeling and Simulations + Econophysics Colloquium 2014, Kobe, Japan, 2014,,Analysis of chain bankruptcies on multiplex Japanese Inter-firm Networks
2014.11.04.,,Yoshihiro Yura, Hideki Takayasu, Misako Takayasu,,Social Modeling and Simulations + Econophysics Colloquium 2014, Kobe, Japan, 2014,,Financial Brownian Particle in the Layered Order-Book Fluid from a point of view of statistical physics
2014.11.04.,,Hirokazu Kawamoto, Hideki Takayasu, Misako Takayasu,,Social Modeling and Simulations + Econophysics Colloquium 2014, Kobe, Japan, 2014,,Analysis of Robustness for a Japanese Business Relation Network by Percolation Simulation
2014.11.04.,,Tsuyoshi Deguchi, Hideki Takayasu, Misako Takayasu,,Social Modeling and Simulations + Econophysics Colloquium 2014, Kobe, Japan, 2014,,Gravity Model Simulation of the International Trade Network using a Preferentially Selected Network
2014.11.04.,,Kazuya Sato, Hideki Takayasu, Misako Takayasu,,Social Modeling and Simulations + Econophysics Colloquium 2014, Kobe, Japan, 2014,,Change-Point Detection of Time-series Data in the Blogosphere
2014.11.04.,,Masahiro Uehara, Hideki Takayasu, Misako Takayasu,,Social Modeling and Simulations + Econophysics Colloquium 2014, Kobe, Japan, 2014,,Currency Strength: Definition and Basic Properties
2014.11.04.,,Mizuki Kurihara, Hideki Takayasu, Misako Takayasu,,Social Modeling and Simulations + Econophysics Colloquium 2014, Kobe, Japan, 2014,,Structural dependence of firms’ growth in inter-firm trading network
2014.11.04.,,Masashi Matsuzaki, Hideki Takayasu, Misako Takayasu,,Social Modeling and Simulations + Econophysics Colloquium 2014, Kobe, Japan, 2014,,Statistical properties observed in Japanese Inter-firm Investment network
